{
  "$schema": "http://json-schema.org/draft-07/schema#",
  "$id": "https://plc-framework/config.schema.json",
  "title": "PLC-Framework project configuration",
  "description": "Structural contract for .plc-framework/config.json. It is the only one of the three validators that runs while the file is being typed - Core's run before a save and after a load, and they catch the four rules JSON Schema cannot express: that an implements entry names a rule that exists, that rule ids are unique, that sibling folder names are unique, and that a regex compiles. Draft-07 rather than 2020-12, for editor support; nothing here needs the newer draft.",

  "type": "object",
  "required": [
    "metadata",
    "projectConfig"
  ],

  "properties": {
    "$schema": {
      "type": "string",
      "description": "Points at this file, which is what makes an editor validate while you type."
    },
    "metadata": {
      "$ref": "#/definitions/metadata"
    },
    "coreRemoteRepositoryConfig": {
      "type": "object",
      "description": "The hosted repository holding the core. Validated only when coreSource is remote; kept but ignored otherwise, as Core ignores it."
    },
    "coreLocalRepositoryConfig": {
      "type": "object",
      "description": "A core on this machine or a mapped drive. Validated only when coreSource is local; kept but ignored otherwise, as Core ignores it."
    },
    "projectConfig": {
      "$ref": "#/definitions/projectConfig"
    }
  },

  "allOf": [
    {
      "if": {
        "required": [
          "metadata"
        ],
        "properties": {
          "metadata": {
            "required": [
              "coreSource"
            ],
            "properties": {
              "coreSource": {
                "const": "remote"
              }
            }
          }
        }
      },
      "then": {
        "required": [
          "coreRemoteRepositoryConfig"
        ],
        "properties": {
          "coreRemoteRepositoryConfig": {
            "$ref": "#/definitions/remoteRepository"
          }
        }
      }
    },
    {
      "if": {
        "required": [
          "metadata"
        ],
        "properties": {
          "metadata": {
            "required": [
              "coreSource"
            ],
            "properties": {
              "coreSource": {
                "const": "local"
              }
            }
          }
        }
      },
      "then": {
        "required": [
          "coreLocalRepositoryConfig"
        ],
        "properties": {
          "coreLocalRepositoryConfig": {
            "$ref": "#/definitions/localRepository"
          }
        }
      }
    }
  ],

  "definitions": {
    "metadata": {
      "type": "object",
      "description": "Holds coreSource, which decides the rest of the file.",
      "properties": {
        "coreSource": {
          "enum": [
            "local",
            "remote",
            null
          ],
          "description": "Which repository section this configuration uses, and therefore which one is required. null - or no key at all - means no repository: only the actions that read a core need one. Neither unused section is validated."
        },
        "version": {
          "type": "string",
          "pattern": "^v\\d{1,2}(\\.\\d{1,2}){1,3}$",
          "description": "Two to four components of up to two digits each: v2.0, v1.12.3, v9.9.9.9."
        },
        "author": {
          "type": "string",
          "description": "Informative. Not validated."
        },
        "description": {
          "type": "string",
          "description": "Informative. Not validated."
        }
      }
    },

    "remoteRepository": {
      "type": "object",
      "description": "The hosted repository holding the core. Required and validated when coreSource is remote, ignored otherwise.",
      "required": [
        "apiUrl",
        "owner",
        "repository",
        "branch",
        "dependencyFile"
      ],
      "allOf": [
        {
          "$ref": "#/definitions/coreFolderRequired"
        }
      ],
      "properties": {
        "provider": {
          "enum": [
            "github"
          ],
          "description": "Which host's API to speak. Absent means github, which is what every configuration written before this key existed says by omission. It is here rather than in coreSource because that one answers a different question: a folder on this machine, or a repository over a wire."
        },
        "apiUrl": {
          "type": "string",
          "pattern": "^https?://",
          "description": "The provider's API endpoint, absolute and http or https: https://api.github.com/ for github.com, or a self-hosted instance's own."
        },
        "owner": {
          "type": "string",
          "pattern": "\\S",
          "description": "Repository owner."
        },
        "repository": {
          "type": "string",
          "pattern": "\\S",
          "description": "Repository name."
        },
        "branch": {
          "type": "string",
          "pattern": "\\S",
          "description": "Branch to read from. The template ships main."
        },
        "coreFolder": {
          "$ref": "#/definitions/coreFolder"
        },
        "folder": {
          "$ref": "#/definitions/legacyFolder"
        },
        "templateFolder": {
          "$ref": "#/definitions/templateFolder"
        },
        "dependencyFile": {
          "type": "string",
          "pattern": "\\S",
          "description": "Dependency graph file name, today core.json."
        },
        "token": {
          "type": "string",
          "description": "Always a ${VARIABLE} reference and never the secret - ${REPO_TOKEN} for github: this file lives in a TIA project and TIA projects are under version control, so the value goes to the per-user .env instead. Nothing in the framework knows the variable's name, so a second provider names its own. Absent or empty means a public repository."
        }
      }
    },

    "localRepository": {
      "type": "object",
      "description": "A core on this machine or a mapped drive. Required and validated when coreSource is local, ignored otherwise.",
      "required": [
        "repository",
        "dependencyFile"
      ],
      "allOf": [
        {
          "$ref": "#/definitions/coreFolderRequired"
        }
      ],
      "properties": {
        "repository": {
          "type": "string",
          "pattern": "\\S",
          "description": "Local path to the repository. That it exists is environmental, and checked separately: a configuration is not wrong because a drive is not mapped here."
        },
        "coreFolder": {
          "$ref": "#/definitions/coreFolder"
        },
        "folder": {
          "$ref": "#/definitions/legacyFolder"
        },
        "templateFolder": {
          "$ref": "#/definitions/templateFolder"
        },
        "dependencyFile": {
          "type": "string",
          "pattern": "\\S",
          "description": "Dependency graph file name, today core.json."
        }
      }
    },

    "coreFolderRequired": {
      "description": "The core's path is required under either name, coreFolder or the folder it was called until 2026-09-30. Carrying both is what Core's validator reports: the schema has to accept either, so it cannot object to the pair.",
      "anyOf": [
        {
          "required": [
            "coreFolder"
          ]
        },
        {
          "required": [
            "folder"
          ]
        }
      ]
    },

    "coreFolder": {
      "type": "string",
      "pattern": "\\S",
      "description": "Path inside the repository down to the core, with forward slashes: plc/s7-1x00/core."
    },

    "legacyFolder": {
      "type": "string",
      "pattern": "\\S",
      "description": "The former name of coreFolder, still read so that a configuration already living in a TIA project keeps working. The editor renames it the first time it opens the file, so a document migrates on its next save."
    },

    "templateFolder": {
      "type": "string",
      "description": "Optional. Path inside the repository down to the templates a block can be generated from, such as plc/s7-1x00/template. Absent or empty means this repository offers none - so it is not held to the pattern the required paths carry, which would underline an empty value Core reads as no templates. On a local repository, that it exists is environmental, like the repository's own path."
    },

    "projectConfig": {
      "type": "object",
      "description": "What the Add-In applies to the TIA project.",
      "required": [
        "hierarchy",
        "codingStyle"
      ],
      "properties": {
        "hierarchy": {
          "$ref": "#/definitions/hierarchy"
        },
        "codingStyle": {
          "$ref": "#/definitions/codingStyle"
        }
      }
    },

    "hierarchy": {
      "type": "object",
      "description": "The folder tree to create. Every list is required but may be empty: [] says this concern has no folders, while a missing key says nothing at all.",
      "required": [
        "blocks",
        "technologyObjects",
        "tagTables",
        "types"
      ],
      "properties": {
        "blocks": {
          "$ref": "#/definitions/groupList"
        },
        "technologyObjects": {
          "$ref": "#/definitions/groupList"
        },
        "tagTables": {
          "$ref": "#/definitions/groupList"
        },
        "types": {
          "$ref": "#/definitions/groupList"
        },
        "softwareUnits": {
          "$ref": "#/definitions/softwareUnits"
        }
      }
    },

    "softwareUnits": {
      "type": "object",
      "description": "Applied inside every software unit. Optional as a whole - only the S7-1500 has them, and on an S7-1200 the section is ignored - but once present all three lists are required. There is deliberately no technologyObjects here: a software unit exposes blocks, tag tables and types only.",
      "required": [
        "blocks",
        "tagTables",
        "types"
      ],
      "properties": {
        "blocks": {
          "$ref": "#/definitions/groupList"
        },
        "tagTables": {
          "$ref": "#/definitions/groupList"
        },
        "types": {
          "$ref": "#/definitions/groupList"
        }
      }
    },

    "groupList": {
      "type": "array",
      "description": "Folders for one concern. May be empty.",
      "items": {
        "$ref": "#/definitions/group"
      }
    },

    "group": {
      "type": "object",
      "description": "One folder, and whatever nests inside it.",
      "required": [
        "name"
      ],
      "properties": {
        "name": {
          "type": "string",
          "pattern": "\\S",
          "description": "Folder name. Must be unique among siblings of the same parent - which JSON Schema cannot check, so Core's validator does. The same name in a different branch is legal: they are different folders."
        },
        "groups": {
          "type": "array",
          "description": "Sub-folders. Same rules, all the way down.",
          "items": {
            "$ref": "#/definitions/group"
          }
        }
      }
    },

    "codingStyle": {
      "type": "object",
      "description": "Naming rules, and which TIA object types are held to them. Same rule as the hierarchy: every list of type objects is required and may be empty. The rule catalogue is split in two because the two kinds are referenced from different places and never stand in for one another - but their ids are unique across both, so an id in a report names exactly one rule.",
      "required": [
        "blocks",
        "technologyObjects",
        "tagTables",
        "types",
        "alarmTextLists"
      ],
      "anyOf": [
        {
          "required": [
            "objectRules"
          ]
        },
        {
          "required": [
            "rules"
          ]
        }
      ],
      "properties": {
        "objectRules": {
          "type": "array",
          "description": "Rules for the names of TIA objects. This is what every implements entry points at, and each may carry an interface saying what belongs inside the object it names.",
          "items": {
            "$ref": "#/definitions/objectRule"
          }
        },
        "interfaceRules": {
          "type": "array",
          "description": "Rules for the names of what lives inside an object: interface members, tags, constants. Optional, so a configuration written before the catalogue was split stays valid. Referenced only from an object rule's interface.",
          "items": {
            "$ref": "#/definitions/interfaceRule"
          }
        },
        "rules": {
          "type": "array",
          "description": "The former name of objectRules, still read so that a configuration already living in a TIA project keeps working. The editor writes the current name, so a document migrates the first time somebody saves it. Carrying both keys is what Core's validator reports.",
          "items": {
            "$ref": "#/definitions/objectRule"
          }
        },
        "blocks": {
          "type": "array",
          "items": {
            "$ref": "#/definitions/blockObject"
          }
        },
        "technologyObjects": {
          "type": "array",
          "items": {
            "$ref": "#/definitions/technologyObject"
          }
        },
        "tagTables": {
          "type": "array",
          "items": {
            "$ref": "#/definitions/tagTableObject"
          }
        },
        "types": {
          "type": "array",
          "items": {
            "$ref": "#/definitions/typeObject"
          }
        },
        "alarmTextLists": {
          "type": "array",
          "items": {
            "$ref": "#/definitions/alarmTextListObject"
          }
        }
      }
    },

    "ruleId": {
      "type": "string",
      "pattern": "\\S",
      "description": "Unique across BOTH catalogues - which JSON Schema cannot check, so Core's validator does."
    },

    "ruleRegex": {
      "type": "string",
      "pattern": "\\S",
      "description": "Naming pattern. That it compiles is checked by Core's validator: a pattern that cannot compile is a broken file, not a broken machine. Note an empty pattern would match every name ever written."
    },

    "ruleDescriptions": {
      "type": "array",
      "description": "Human-readable explanation of the rule, one line each.",
      "items": {
        "type": "string"
      }
    },

    "objectRule": {
      "type": "object",
      "description": "One rule for the name of a TIA object.",
      "required": [
        "id",
        "regex"
      ],
      "properties": {
        "id": {
          "$ref": "#/definitions/ruleId"
        },
        "regex": {
          "$ref": "#/definitions/ruleRegex"
        },
        "descriptions": {
          "$ref": "#/definitions/ruleDescriptions"
        },
        "interface": {
          "$ref": "#/definitions/interface"
        }
      }
    },

    "interfaceRule": {
      "type": "object",
      "description": "One rule for the name of something that lives inside an object.",
      "required": [
        "id",
        "regex"
      ],
      "properties": {
        "id": {
          "$ref": "#/definitions/ruleId"
        },
        "regex": {
          "$ref": "#/definitions/ruleRegex"
        },
        "descriptions": {
          "$ref": "#/definitions/ruleDescriptions"
        },
        "interface": false
      }
    },

    "implements": {
      "type": "array",
      "description": "The rules held against a name, as ALTERNATIVES: it passes if it matches any one of them. Not empty, and every entry must name an existing rule in the catalogue this list is allowed to reach - object rules from a type, interface rules from an interface. The reference itself is what Core's validator checks, since JSON Schema cannot look across the document.",
      "minItems": 1,
      "items": {
        "type": "string",
        "pattern": "\\S"
      }
    },

    "interfaceSection": {
      "type": "object",
      "description": "One section of this type's interface, and the rules its members answer to.",
      "required": [
        "type",
        "implements"
      ],
      "properties": {
        "type": {
          "enum": [
            "Input",
            "Output",
            "InOut",
            "Static",
            "Temp",
            "Constant",
            "Tag",
            "UserConstant"
          ],
          "description": "Closed set, spelled as TIA spells it. The first six are the sections of a block interface; the last two are a tag table's, named apart because a tag and a user constant answer to different rules. Listing the same section twice is what Core's validator catches, since JSON Schema's uniqueItems compares whole objects rather than one field."
        },
        "implements": {
          "$ref": "#/definitions/implements"
        }
      }
    },

    "interface": {
      "type": "array",
      "description": "Optional. Naming rules for what lives inside this object, per interface section. Absent means the interface is not checked - which is the state of every configuration written before this existed. It is nested inside the type rather than declared as a flat variables list because the binding carries the meaning: a static of an FB and a temp of an FC are both variables and may answer to different rules.",
      "items": {
        "$ref": "#/definitions/interfaceSection"
      }
    },

    "blockObject": {
      "type": "object",
      "required": [
        "type",
        "implements"
      ],
      "properties": {
        "type": {
          "enum": [
            "OB",
            "ArrayDB",
            "GlobalDB",
            "InstanceDB",
            "FC",
            "FB"
          ],
          "description": "Closed set. A value outside it cannot ever match a real object."
        },
        "implements": {
          "$ref": "#/definitions/implements"
        }
      }
    },

    "technologyObject": {
      "type": "object",
      "required": [
        "type",
        "implements"
      ],
      "properties": {
        "type": {
          "enum": [
            "TechnologicalInstanceDB"
          ],
          "description": "Closed set."
        },
        "implements": {
          "$ref": "#/definitions/implements"
        }
      }
    },

    "tagTableObject": {
      "type": "object",
      "required": [
        "type",
        "implements"
      ],
      "properties": {
        "type": {
          "enum": [
            "PlcTagTable"
          ],
          "description": "Closed set."
        },
        "implements": {
          "$ref": "#/definitions/implements"
        }
      }
    },

    "typeObject": {
      "type": "object",
      "required": [
        "type",
        "implements"
      ],
      "properties": {
        "type": {
          "enum": [
            "PlcStruct"
          ],
          "description": "Closed set."
        },
        "implements": {
          "$ref": "#/definitions/implements"
        }
      }
    },

    "alarmTextListObject": {
      "type": "object",
      "required": [
        "type",
        "implements"
      ],
      "properties": {
        "type": {
          "enum": [
            "AlarmTexts"
          ],
          "description": "Closed set."
        },
        "implements": {
          "$ref": "#/definitions/implements"
        }
      }
    }
  }
}
