{
  "metadata":
  {
    "version" : "v1.0",
    "author" : "",
    "description" : "",
    "coreSource" : null
  },
  "coreRemoteRepositoryConfig" :
  {
    "provider" : "github",
    "apiUrl" : "https://api.github.com/",
    "owner" : "PLC-Framework",
    "repository" : "code",
    "branch": "main",
    "coreFolder" : "plc/s7-1x00/core",
    "templateFolder" : "plc/s7-1x00/template",
    "dependencyFile" :  "core.json",
    "token" : "${REPO_TOKEN}"
  },
  "coreLocalRepositoryConfig" :
  {
    "repository" : "C:/path/to/your/core-repository",
    "coreFolder" : "plc/s7-1x00/core",
    "templateFolder" : "plc/s7-1x00/template",
    "dependencyFile": "core.json"
  },
  "projectConfig" :
  {
    "hierarchy" :
    {
      "blocks" : 
      [
        {"name" : "00-OB"},
        {"name" : "01-FSL"},
        {"name" : "02-SCL"},
        {"name" : "03-ALL", "groups" : 
        [
          {"name" : "IT"},
          {"name" : "Nodes"},
          {"name" : "Sequences", "groups" : [{"name" : "0-Containers"}]}
        ]},
        {"name" : "04-CL", "groups" : [{"name" : "0-Containers"}]},
        {"name" : "10-HW"},
        {"name" : "11-HMI"},
        {"name" : "core"},
        {"name" : "custom"},
        {"name" : "vendor"},
        {"name" : "provisional"}
      ],
      "technologyObjects" : [
        {"name" : "04-CL"}
      ],
      "tagTables" :
      [
        {"name" : "core"},
        {"name" : "custom"},
        {"name" : "vendor"},
        {"name" : "provisional"},
        {"name" : "io"}
      ],
      "types" :
      [
        {"name" : "core"},
        {"name" : "custom"},
        {"name" : "vendor"},
        {"name" : "provisional"}
      ],
      "softwareUnits" :
      {
        "blocks" :
        [
          {"name" : "core"},
          {"name" : "custom"},
          {"name" : "vendor"}
        ],
        "tagTables" :
        [
          {"name" : "core"},
          {"name" : "custom"}
        ],
        "types" :
        [
          {"name" : "core"},
          {"name" : "custom"}
        ]
      }
    },
    "codingStyle" :
    {
      "interfaceRules" :
      [
        {
          "id" : "constant",
          "regex" : "^[A-Z][A-Z0-9]*(?:_[A-Z0-9]+)*$",
          "descriptions" :
          [
            "Constant Naming Rules",
            "1. The identifier must always start with an uppercase letter (A-Z).",
            "2. Only uppercase letters, digits (0-9), and underscores (_) are allowed.",
            "3. Words are separated using a single underscore (_).",
            "4. Consecutive underscores (__) are not allowed.",
            "5. The identifier must not start or end with an underscore.",
            "6. After each underscore, the next character must be an uppercase letter or a digit.",
            "7. Only uppercase letters are allowed (no lowercase characters)."
          ]
        },
        {
          "id" : "variable",
          "regex" : "^[a-z][a-zA-Z0-9]*$",
          "descriptions" :
          [
            "Variable Naming Rules",
            "1. The identifier must start with a lowercase letter.",
            "2. Words are separated using camelCase (the first letter of each subsequent word is uppercase).",
            "3. Digits (0-9) are allowed anywhere except as the first character of the identifier.",
            "4. The underscore (_) is not allowed anywhere in the name.",
            "5. A name that needs a semantic separator is a structured variable and answers to structured_variable instead.",
            "6. Only letters (A-Z, a-z) and digits (0-9) are allowed."
          ]
        },
        {
          "id" : "structured_variable",
          "regex" : "^[a-z][a-zA-Z0-9]*_[a-z0-9][a-zA-Z0-9]*$",
          "descriptions" :
          [
            "Structured Variable Naming Rules",
            "1. The identifier follows the variable rules, with one underscore (_) allowed as a semantic separator.",
            "2. The identifier must start with a lowercase letter.",
            "3. Words within a segment are separated using camelCase (the first letter of each subsequent word is uppercase).",
            "4. Digits (0-9) are allowed anywhere except as the first character of the identifier.",
            "5. Exactly one underscore is allowed, and it may be anywhere except as the first or the last character.",
            "6. After the underscore, the next character must be a lowercase letter or a digit.",
            "7. Consecutive underscores (__) are not allowed, and neither is a second separator elsewhere in the name.",
            "8. Only letters (A-Z, a-z), digits (0-9), and underscores (_) are allowed."
          ]
        },
        {
          "id" : "command_variable",
          "regex" : "^cmd[0-9]{1,3}[a-z]?_[a-z][a-zA-Z0-9]*$",
          "descriptions" :
          [
            "Command Variable Naming Rules",
            "1. The identifier must start with the prefix cmd.",
            "2. The prefix is followed by one to three digits, leading zeros included: cmd0, cmd00, cmd000 and cmd999 are all accepted.",
            "3. The digits may be followed by a single lowercase letter, which is optional.",
            "4. A single underscore (_) always follows, and it is the only one in the name.",
            "5. After the underscore the name follows the variable rules: it starts with a lowercase letter and continues in camelCase, with digits allowed anywhere but that first character.",
            "6. Only letters (A-Z, a-z), digits (0-9) and that one underscore are allowed.",
            "7. It belongs to the Input of object_container_for_sequences and nowhere else, which is where a sequence takes the commands that drive it."
          ]
        },
        {
          "id" : "waiting_point_variable",
          "regex" : "^wp[0-9]{1,3}[a-z]?_[a-z][a-zA-Z0-9]*$",
          "descriptions" :
          [
            "Waiting Point Variable Naming Rules",
            "1. The identifier must start with the prefix wp.",
            "2. The prefix is followed by one to three digits, leading zeros included: wp0, wp00, wp000 and wp999 are all accepted.",
            "3. The digits may be followed by a single lowercase letter, which is optional.",
            "4. A single underscore (_) always follows, and it is the only one in the name.",
            "5. After the underscore the name follows the variable rules: it starts with a lowercase letter and continues in camelCase, with digits allowed anywhere but that first character.",
            "6. Only letters (A-Z, a-z), digits (0-9) and that one underscore are allowed.",
            "7. It belongs to the Output of object_container_for_sequences and nowhere else, which is where a sequence says which waiting point it has reached. It is command_variable with wp where that one has cmd."
          ]
        },
        {
          "id" : "sequence_variable",
          "regex" : "^S[0-9]{3}_[A-Z][a-zA-Z0-9]*(?:_[a-z0-9][a-zA-Z0-9]*)*$",
          "descriptions" :
          [
            "Sequence Variable Naming Rules",
            "1. The identifier must start with an uppercase S.",
            "2. The S is followed by exactly three digits (000-999): the step number.",
            "3. The digits are followed by a single underscore (_).",
            "4. The name after that underscore must start with an uppercase letter and continue in camelCase (the first letter of each subsequent word is uppercase).",
            "5. The underscore (_) may be used as a semantic separator between logical segments.",
            "6. After each semantic separator, the next character must be a lowercase letter or a digit.",
            "7. Consecutive underscores (__) are not allowed.",
            "8. The identifier must not end with an underscore.",
            "9. Only letters (A-Z, a-z), digits (0-9), and underscores (_) are allowed."
          ]
        },
        {
          "id" : "transition_variable",
          "regex" : "^t_[0-9]{3}_(?:[0-9]{3}|nop)$",
          "descriptions" :
          [
            "Transition Variable Naming Rules",
            "1. The identifier must start with the prefix t_.",
            "2. The prefix is followed by exactly three digits (000-999): the step the transition leaves.",
            "3. The digits are followed by a single underscore (_).",
            "4. The identifier ends with either three more digits (000-999), the step the transition enters, or the literal nop when it enters none.",
            "5. Nothing else is allowed: the whole name is the prefix, two segments and the separators between them."
          ]
        },
        {
          "id" : "interruption_parameter",
          "regex" : "^(Initial_Call|Remanence)$",
          "descriptions" :
          [
            "Interruption Parameter Naming Rules",
            "TIA Portal writes these into an OB's Input itself and nobody can rename them, so no naming convention of yours applies to them: Initial_Call, true on the first call after a restart, and Remanence, true when retentive data was kept.",
            "Every name inside a block is checked, TIA's own included, so this rule is what lets them pass. It belongs to the Input of interruption and nowhere else: an OB's Temp and Constant are the engineer's, and answer to variable and constant.",
            "1. The name must be one of the list, spelled exactly as TIA spells it.",
            "2. The pattern is closed at both ends, so it accepts those two names and nothing that merely starts with one of them.",
            "3. When an OB type brings a parameter this does not name yet - a hardware interrupt's LADDR and USI, a time error's Fault_ID - add it to the list rather than loosening the pattern. The report names the member that failed, which is where you will see it first."
          ]
        },
        {
          "id" : "graph_parameter",
          "regex" : "^(INIT_SQ|ACK_EF|S_NO|S_MORE|S_ACTIVE|RT_DATA)$",
          "descriptions" :
          [